full_text,username
pakar ugm kritik keras tingkah gibran debat cawapres cak imin mahfud elegan httpstcosndledypz,tvOneNews
gaya gibran sebal debat cawapres sorot tpn ganjarmahfud allah buka mata hati warga indonesia httpstcogtugzgoq,tvOneNews
pemuda nyanyi yel terima kasih prabowogibran persis mobil mercedesbenz tumpang aniesimin parkir kawasan jcc senayan jakpus debat cawapres yukbalikfokuspemilu memastikanditps menang guemausatuputaran souce httpstcodjvugfvlm,Ndons_Back
serang prabowo abang ga etika debat kemarin debat anak ingus orang tua debat mahasiswa doses debat cawapres posisi tara httpstcohzaqbuiz,Heraloebss
survei elektabilitas serta pilpres debatcawapres gibran httpstcoyqnofnc,Heraloebss
nyadar el slepet pas debat cawapres kemarin slepet,idextratime
sudut pandang cerita sudut pandang prabowo gibran moga prabowogibran gibran gibranrakabuming debatcawapres httpstcoaaldmzfdi,WaktunyaIDMaju
drone emprit nilai gibran rakabuming raka oleh sentimen negatif media sosial x debat cawapres januari tempodotco cakimin gibran mahfudmd httpstcokpowknpzt,tempodotco
anies gus imin bawa tumbler debatcawapres malam botol plastik sedia panitia el sulfat tuduh malam aminajadulu httpstcopfmxiklq,BangPino__
gibran raih ekspos sentimen positif tinggi debat cawapres httpstcoeuqcweqn,tvOneNews
gera mulut emil dardak sang juru bicara gera mulut gibran debatcawapres httpstcoxrogoteena,MurtadhaOne1
simpul debat cawapres smlem tinggal debat capres httpstcoedrsxwgpl,xquitavee
warga xland sibuk bahas debat capres cawapres meanwhile muhammadiyah httpstcoyregtwbta,MuhammadiyinGL
isu bohong pasca debat dukung paslon ramai ramai sebar isu bohong strategi tutup sentimen negatif gibran blunder debat cawapres httpstcoahjfazfaw,Yurissa_Samosir
kabar prens debat cawapres bolone gibran alih dukung paslon deklarasi senin januari jahat kelamin tpd jalan hang lekir xii no lurah gunung kebayoran jakarta selatan gpmmd ganjarmahfud httpstcodogxvbtug,YRadianto
lewat gibran debatcawapres sosok muda mudah adaptasi ubah tempat kelah narasi rendah hati gera tubuh bicara ribu orang dengar beda mari httpstcoijdtnlln,Heraloebss
tanggap pembacasetiajawapos debat empat malam mari diskusi kolom komentar iya kasih alas pilih paslon cawapres pilih tps jawaposkawalpemilu,jawapos
libat generasi muda kritis debat cawapres kuat demokrasi suara kritik jabat takut dorong partisipasi aktif pikir kritis lapis masyarakat httpstcomhbqaeutwf,BHauser
tsamaradki twit debat cawapres malam sdh juta views intimidasi biarin emang cari moment suka suka undecided putar wujud gazzz,kurawa
greenflation o machfud sbg receh aju o gibrantweet debat cawapres malam strategis dampak ekonomi amp ekologi menangindonesiamaju httpstconptqaxfv,budimandjatmiko
tolak lupa alas ga gabung tim prabowo tsamaradki prabowo sejarah kelam culik aktivis bangsa silah nilai politis orang debatcawapres httpstcohwntjbowgw,ch_chotimah2
serang personal budi pekerti jokowi nasehat rakyat indonesia lupa nasehat gibran anak miris presiden kenal rendah hati anak sombong jokowi anak muda nilai budi pekerti debatcawapres httpstcoubwydbfq,ch_chotimah2
tanggap debat cawapres teliti csis bilang hilir httpstcordpoayc temponasional,tempodotco
debatcawapres httpstcoighnrilrj,andori
tampil pesona gibran ukur tantang zaman kini httpstcoudmtxpwvk beritasatu debatcawapres debatcaprescawapres,Beritasatu
fisik ganjar sabtu malam malam minggu hadir hajat rakyat bal minggu pagi sidoarjo minggu siang hadir hajat rakyat bandung mega minggu malam malam senin hadir debat cawapres jakarta indonesia butuh httpstconsqqsvknyh,03__nakula
prabowo malu acara debat malam malu cawapres malam terima kasih gibrantweet sdh wakil sakit hati prabowoadalahindonesia prabowoaja prabowountuksemua prabowothelivinglegend prabowopresiden bismillah httpstcoktzpsqxjc,Chavesz08
yenny wahid kecewa sikap gibran debat cawapres leceh httpstcocaekaarzlg,akupadi5
rakyat tani orang madura suara dukung paslon kecam debatcawapres gibran ga etika alat tani bukti rendah rendah rakyat prof mahfud rendah httpstcowghbqmorh,ch_chotimah2
cawapres nomor urut muhaimin iskandar cak imin kesal tingkah cawapres nomor urut gibran rakabuming raka debat gelar malam ajar etika gibran wali kota solo httpstcofsvkafed,tvOneNews
debat cawapres gibran sebut guna biofuel sawit turun impor minyak data bps data bisnisupdate update bisnis text httpstcoynoblapk,kumparan
dukung dukung prabowo gibran bungul tsamaradki debatcawapres httpstcotzfclsucoz,ch_chotimah2
yenny wahid debat cawapres rusak akibat kandidat remeh paslon httpstcouryzktuuc,KompasTV
savage perhati tomlembong th contek ayah mas gibran bilang muka publik tim masuk amin fakta no gimik flexing savage debatcawapres httpstcoxpsvqzpcg,berlianidris
bangga prabowo bangga indonesia gibran rakabuming debat cawapres what a sweet revenge lakuin prabs nilai eh teriak bocah cringe etika etika sebal sombong httpstcofmnsrro,NyaiiBubu
brief pasca debat cawapres kakak bina american style baper ditroll anies ganjar kemarin serang personal iya gibran serang baper dukung amp standar ganda yuk list brief,fmuchtaar
momen peluk abah aniesbaswedan gus cakiminow debatcawapres malam situasi amp angle kamera bangga bahagia amp haru kompak paslon bayang sdh lantik kompak amp sinergi httpstcouptderx,BangPino__
fatal akibat ulah sebal debat cawapres sentimen negatif gibran capai prabowo potensi singkir putar httpstcobwixfsa,abu_waras
fakta debatcawapres dukung amp nyebokin cawapresnya dukung nyebokin dukung httpstcoopaafbves,Heraloebss
coba polling ah gaya debat cawapres gibran malam,msaid_didu
prabowo puji gibran paham ekonomi debat cawapres tema lingkung hidup pangan agraria masyarakat adat httpstcohnujivkfe temponasional,tempodotco
karakter tumbuh asuh biasa tahu teladan bungfadjroel debatcawapres debatcapres httpstcojodsfbf,fadjroeL
kenal modus ragam tambang ilegal debatcawapres athread izin operasi izin tambang konsesi wilayah izin usaha tambang wiup lewat pagar batas wilayah izin tambang httpstcomqqknfgn,Heraloebss
alas cak imin debat bagus malam bagus takut gembok bu rustini debatcawapres httpstcouhfoaxjzb,Mdy_Asmara1701
prabowo mana cari etika debat cawapres httpstcomdcklgdw,MarahIchsan
receh erti budimandjatmiko greenflation istilah ekonomi erti receh greenflation rujuk naik harga amp krisis tenaga kerja iring dg transisi ramah lingkung greenflation gibran debat cawapres httpstcojlhhwzbkd,PraEquilibrium
alissa wahid nilai sikap gibran debat cawapres leceh orang httpstcojhibrbu,CNNIndonesia
komentar debat cawapres malam penting nentuin pilih cerdas nentuin nasib bangsa bareng psi terus juang indonesia percaya prabowogibran menang putar httpstcooyouevqfg,psi_id
bikin ramai paslon debat capres cawapres ga tawar masuk httpstcomdbkekgd,idextratime
debat kemarin blunder cawapres kemarin pure hominem httpstcoifiukzsat,HusodoYoga
debat cawapres gibran populer lini digital httpstcokwtaexor,VIVAcoid
beda level eks ketua mk kalah debat versus anak haram konstitusi lolos ngejebol tembok mk mahkamah konstitusi gibran samsul tolol sombong tengik adab etika bocil al sulfat debat cawapres httpstcoifmghbfipw,msobri99
hasil survei tv pasca debat samsul gibran prabowo gibran menang putar debatcawapres httpstcozcwvjsvst,RcyberProj0
ga salah prabowo pilih gibran wakil sangsi mampu gibran bantah x debat cawapres sosok muda kuasa panggung salut bocah sebal el sulfat takluk el slepet prof mahfud httpstcotztsowbn,lettachantik
malam bahas botol plastik debat cawapres jelas singkat httpstconoyrgc,AndyHuskyyy
durian orang suka suka banget orang suka benci banget debat malam suka gibran puji habishabisan suka gibran maki habishabisan malas bikin ulas debat cawapres,hasyimmah
debat cawapres terakhirkubu belah dadak bicara etika gibran skakmat cak imin amp prof mahfud debat capres ganjar anies serang prabowoadakah bicara etika pastikn jago pny etika teriak etika lemah httpstcotmjatj,selflove_LyN
beda sopan santun gimmick debatcawapres dadak bicara etika sekian caci maki hina gibran diksi samsul belimbing sayur anak haram anak ingus asu etika gibran orang etika dadak httpstcodlymfjemd,Heraloebss
acara resmi negara debat caprescawapres badut pasar atraksi receh httpstcopuyhvgokvg,AraituLaki
tom lembong savage contek ayah tulis pidato debatcawapres httpstcoydevuyvy,Mdy_Asmara1701
prabowo gibran yusril bahlil diskus sebentar jeda debat cawapres malam balai sidang jakarta httpstcoezciudgubh,Yusrilihza_Mhd
iya usia caprescawapres dulunya minimal simpul lihat performance ecekecek cawapres debat ubah usia bikin kantor paman gibran mk coreng wajah milu httpstcowohlbzconx,TofaJubirAmin
breaking news dengerdengar undur kabinet jabat bumn nonton acara debat cawapres malam tunggu lanjut effectdebatsemalam,abu_waras
semangat senin kakakkakak debat cawapres malam sepakat senantiasa junjung adab akhlak mana ilmu adab nol adab etika akhlak httpstcobexvbhfpss,NasDem
prabowo bangga gibran kapasitas kuasa ekonomi tema debat sda lingkung hidup energi pangan agraria masyarakat adat amp desa asalbukanprabowo debatcawapres httpstconzhxlain,narkosun
informasi a debat empat cawapres elektabilitas prabowo gibran anjlok dukung prabowo gibran waras prediksi banting stir malu prilaku etika gibran mahfud md,abu_waras
dukung debat cawapres aku cak imin under perform kritik cak imin medsos malam dg perform gibran dukung gk kritik gibran gk berani beda,FahmiAgustian
gus nadirs pbnu instruksi dukung prabowogibran bicara netral dukung percaya netral asalbukanprabowo debatcawapres httpstcolnhvnll httpstcolcgkuria,narkosun
kumpul meme debat cawapres temuin twitter a thread httpstcohwkgoyen,spongebobssss_
atas ilmu etika gibran degradasi ilmu etika milik mas gibran debat prof mahfud sama debat tukang jahit pilwalkot solo sih debat akal debatcawapres httpstcoedjbzkogi,Chynthia_K
nm nya tong kosong nyaring bunyi nama gibrantweet banyak gy kosong otak nama tambang ilegal pergi ijinnya jadi srp ktk gibran produk umkm go internasional debatcawapres httpstcokovmyxa,STresnowati1
analisis debat empat cawapres milu januari sentimen isu angkat peta cakap netizen twitterx kait cawapres debat empat twitter januari httpstcoqvafqkwci,ismailfahmi
cok pancing savage keren kepala fico besok bicara gibran ficofachriza pardedereza debatcawapres httpstcolbzsiujpx,fidotriabrahma
debat cawapres malam minimal kali hina si anakharamkonstitisi cakiminow katakata cak imin sdh grogi debat enak baca contek pakai botol plastik cak imim tanggap,msaid_didu
tambang ilegal gibran simpel solusi pergi izin ilegal masilegal ilegal surat izin izin opone cabut mas menang mas lihat debat calon pimpin bangsa kelas cawapres istilah ilegal httpstcoejzhvuot,DrEvaChaniago
sampah dukung tebar habis debat purapura bego bego beneran mas gibrantweet pakai botol plastik debatcawapres malam nyinyirin cak imin munafik aripras anakogi ariyadifebri httpstcozwnelzlncz,David_Wijaya03
gibran sukses tunjuk kualitas pimpin muda paham masalah solusi panggung politik debatcawapres malam hasil asai anak muda httpstcovadpfpsgl,Heraloebss
daftar cawapres bohong bu mega rakyat indonesia ninggalin partai kampanye debat malam konsisten miskin etika salut gibran konsisten sgie si gibran hilang etika debatcawapres httpstcogfyghmej,ch_chotimah2
